{
  "project_root": ".",
  "input_dir": "input",
  "work_dir": "work",
  "output_dir": "output",
  "archive_dir": "archive",
  "question_bank": "input/question_bank.json",
  "paper_count": 3,
  "random_seed": 20260909,
  "requirements": {
    "questions": 22,
    "by_type": {"选择题": 10, "填空题": 6, "解答题": 6},
    "max_source_repetition": 3,
    "allow_cross_paper_reuse": false,
    "min_subject_coverage": {},
    "max_difficulty_deviation": 1
  },
  "mathjax_local_script": "",
  "mathjax_url": "",
  "mathjax_allow_network": false,
  "mathjax_auto_download": true,
  "mathjax_version": "4.1.3",
  "prompt_version": "",
  "prompt_hash": "",
  "models": [],
  "runtime": {},
  "pdf": {
    "enabled": true,
    "chromium": "",
    "paper_width": 8.27,
    "paper_height": 11.7,
    "margin_top": 0,
    "margin_bottom": 0,
    "margin_left": 0,
    "margin_right": 0
  }
}
